{
  "adapter": {
    "capabilities": [
      "console",
      "dom",
      "isolated-contexts",
      "network-routing",
      "screenshots",
      "viewport",
      "explicit-visual-regression-baseline",
      "detector-policy-fingerprint"
    ],
    "isolation": "fresh-context",
    "name": "project-playwright"
  },
  "config": {
    "allowRemote": false,
    "failOn": "major",
    "policyFingerprint": "sha256:4bf4b7cef34ca036d91cc6ef228501c1cd8d610acd61c823074f2b5d102cb77e"
  },
  "findings": [
    {
      "classification": "existing",
      "confidence": "high",
      "evidence": [
        {
          "label": "Current deterministic visual snapshot",
          "path": "screenshots/visual-current.png",
          "type": "screenshot"
        },
        {
          "label": "Explicitly approved visual baseline",
          "path": "screenshots/visual-approved.png",
          "type": "screenshot"
        },
        {
          "label": "Visual pixel difference",
          "path": "screenshots/visual-diff.png",
          "type": "screenshot"
        }
      ],
      "fingerprint": "f9dfd0afa50da15a109ead1ad0b4c390f4a947e8b6f8274f968693ee250ddcf5",
      "id": "RC-F9DFD0AFA5",
      "measurements": {
        "baselineHeight": 900,
        "baselineWidth": 1440,
        "changedPixels": 245207,
        "currentHeight": 900,
        "currentWidth": 1440,
        "diffRatio": 0.18920293209876543,
        "dimensionsMatch": true,
        "maskedSelectors": 1,
        "maxDiffRatio": 0.002,
        "pixelThreshold": 28,
        "totalPixels": 1296000
      },
      "remediation": {
        "summary": "Repair the unintended application-owned rendering change and rerun the audit. If the change is intentional, review it and explicitly replace the baseline with visual-approve --replace-baseline.",
        "technicalHints": [
          "Do not raise the threshold or overwrite the baseline solely to clear the gate."
        ]
      },
      "reproductionSteps": [
        "Open the route in the same clean desktop viewport.",
        "Compare visual-current.png, visual-approved.png, and visual-diff.png."
      ],
      "ruleId": "visual-regression-threshold",
      "scenarioId": "baseline",
      "selector": "html",
      "severity": "major",
      "summary": "245,207 pixel(s) changed (18.920%); the approved maximum is 0.200%.",
      "title": "Current rendering differs from the approved visual baseline",
      "translations": {
        "zh-CN": {
          "remediation": {
            "summary": "修复非预期且由应用造成的渲染变化后重新核查；若变化确属预期，应先人工复核，再通过 visual-approve --replace-baseline 显式替换基线。",
            "technicalHints": [
              "不要只为通过门禁而提高阈值或覆盖基线。"
            ]
          },
          "reproductionSteps": [
            "在相同的干净桌面视口中打开该路由。",
            "对比 visual-current.png、visual-approved.png 与 visual-diff.png。"
          ],
          "summary": "245,207 个像素发生变化（18.920%）；批准的上限为 0.200%。",
          "title": "当前渲染结果与已批准视觉基线不一致"
        }
      },
      "url": "http://127.0.0.1:4183/index.html"
    }
  ],
  "run": {
    "durationMs": 6081.0,
    "finishedAt": "2026-08-04T18:25:43.064Z",
    "id": "20260804T182536Z-ab941b",
    "mode": "quick",
    "startedAt": "2026-08-04T18:25:36.967Z"
  },
  "scenarios": [
    {
      "durationMs": 826.0,
      "id": "baseline",
      "notes": [
        "Baseline runtime findings were recorded."
      ],
      "status": "completed-with-findings",
      "translations": {
        "zh-CN": {
          "notes": [
            "已记录基线运行时问题。"
          ]
        }
      }
    },
    {
      "durationMs": 609.0,
      "id": "mobile-375",
      "notes": [],
      "status": "passed",
      "translations": {
        "zh-CN": {
          "notes": []
        }
      }
    },
    {
      "durationMs": 1285.0,
      "id": "long-text",
      "notes": [
        "7 deterministic text mutations were applied."
      ],
      "status": "passed",
      "translations": {
        "zh-CN": {
          "notes": [
            "已执行 7 次确定性的文本替换。"
          ]
        }
      }
    },
    {
      "durationMs": 1294.0,
      "id": "rtl-arabic",
      "notes": [
        "Directionality stress test only; translation quality was not assessed."
      ],
      "status": "passed",
      "translations": {
        "zh-CN": {
          "notes": [
            "仅进行书写方向压力测试；未评估翻译质量。"
          ]
        }
      }
    },
    {
      "durationMs": 879.0,
      "id": "image-failure",
      "notes": [
        "Expected image request aborts were excluded from failed-request findings."
      ],
      "status": "passed",
      "translations": {
        "zh-CN": {
          "notes": [
            "预期的图片请求中止未计入普通请求失败问题。"
          ]
        }
      }
    },
    {
      "durationMs": 1086.0,
      "id": "keyboard-tab",
      "notes": [
        "No controls were activated or submitted."
      ],
      "status": "passed",
      "translations": {
        "zh-CN": {
          "notes": [
            "未激活或提交任何控件。"
          ]
        }
      }
    }
  ],
  "schemaVersion": "1",
  "score": {
    "baselinePenalty": 4.0,
    "chaosPenalty": 0.0,
    "counts": {
      "critical": 0,
      "info": 0,
      "major": 1,
      "minor": 0
    },
    "ignoredLowConfidenceFindings": 0,
    "overall": 96,
    "scoredFindings": 1,
    "totalFindings": 1
  },
  "target": {
    "finalUrl": "http://127.0.0.1:4183/index.html",
    "requestedUrl": "http://127.0.0.1:4183/index.html",
    "title": "Regressed account overview"
  },
  "threshold": {
    "coveragePercent": 100.0,
    "failOn": "major",
    "met": true,
    "violations": [
      {
        "actual": 1,
        "code": "severity-threshold",
        "expected": 0
      }
    ]
  },
  "toolVersion": "0.4.0",
  "translations": {
    "zh-CN": {
      "warnings": [
        "独立核查使用了已安装的系统浏览器（150.0.7871.116）。",
        "自动化问题仍然属于有边界的观察结果；修复前请人工复核低置信度项目。",
        "视觉回归策略以 failed 状态完成，并使用 1 个声明式 mask；替换基线始终需要显式批准命令。"
      ]
    }
  },
  "warnings": [
    "Standalone audit used an already-installed system browser (150.0.7871.116).",
    "Automated findings remain bounded observations; review low-confidence items before fixing.",
    "Visual regression policy finished with failed state using 1 declared mask(s); baseline replacement always requires an explicit approval command."
  ]
}
