{
  "adapter": {
    "capabilities": [
      "console",
      "dom",
      "isolated-contexts",
      "network-routing",
      "screenshots",
      "viewport",
      "bounded-head-link-integrity",
      "detector-policy-fingerprint"
    ],
    "isolation": "fresh-context",
    "name": "project-playwright"
  },
  "config": {
    "allowRemote": false,
    "failOn": "major",
    "policyFingerprint": "sha256:ad9ac30dadb401b96ad3d492247725efb3b9ca2bbd0b4b68ff963cac6aef5dbb"
  },
  "findings": [
    {
      "classification": "existing",
      "confidence": "high",
      "evidence": [
        {
          "checked": 2,
          "discovered": 4,
          "eligible": 2,
          "excluded": 1,
          "failureSamples": [
            {
              "reason": "http-error",
              "redirects": [],
              "status": 404,
              "url": "http://127.0.0.1:4182/examples/link-lab/missing-guide.html"
            }
          ],
          "failures": 1,
          "limit": 0,
          "method": "HEAD",
          "passed": 1,
          "statusCounts": {
            "200": 1,
            "404": 1
          },
          "truncated": 0,
          "type": "link-integrity",
          "unsupported": 0
        },
        {
          "label": "Same-origin link integrity",
          "path": "screenshots/baseline.png",
          "type": "screenshot"
        }
      ],
      "fingerprint": "d9b4c0700c4dc3a7aef2a3159ae7a7c6d2f2f54ec102ce51d8caec179ca41cba",
      "id": "RC-D9B4C0700C",
      "measurements": {
        "checked": 2,
        "discovered": 4,
        "eligible": 2,
        "excluded": 1,
        "failures": 1,
        "limit": 0,
        "maxRedirects": 5,
        "method": "HEAD",
        "passed": 1,
        "statusCounts": {
          "200": 1,
          "404": 1
        },
        "timeoutMs": 3000,
        "truncated": 0,
        "unsupported": 0
      },
      "remediation": {
        "summary": "Correct or remove every sampled broken href, preserve intentional redirects, and rerun the same link policy without increasing its failure allowance.",
        "technicalHints": [
          "HEAD 405/501 responses are recorded as unsupported rather than broken; verify those endpoints manually or make their HEAD behavior standards-compatible."
        ]
      },
      "reproductionSteps": [
        "Open the page in a fresh context without activating any link.",
        "Collect bounded same-origin anchor targets after the page settles.",
        "Issue HEAD requests only, following at most five same-origin allowed redirects, and compare failures with the configured limit."
      ],
      "ruleId": "link-integrity-failure-budget",
      "scenarioId": "baseline",
      "severity": "major",
      "summary": "1 safely checked same-origin link(s) failed, above the configured maximum of 0.",
      "title": "Broken same-origin links exceed the project budget",
      "translations": {
        "zh-CN": {
          "remediation": {
            "summary": "修正或移除每个样本中的失效 href，保留有意的重定向，并在不提高失败容许数的情况下重新运行同一链接策略。",
            "technicalHints": [
              "HEAD 405/501 会记为不支持而非失效；请人工验证这些端点，或让其 HEAD 行为符合标准。"
            ]
          },
          "reproductionSteps": [
            "在新的上下文中打开页面，不激活任何链接。",
            "页面稳定后收集有上限的同源锚点目标。",
            "仅发送 HEAD 请求，最多跟随五次同源且允许的重定向，并将失败数与配置上限比较。"
          ],
          "summary": "安全核查的同源链接中有 1 个失败，超过配置上限 0。",
          "title": "同源失效链接超过项目预算"
        }
      },
      "url": "http://127.0.0.1:4182/examples/link-lab/broken.html"
    }
  ],
  "run": {
    "durationMs": 5072.0,
    "finishedAt": "2026-08-04T17:19:13.253Z",
    "id": "20260804T171908Z-faed61",
    "mode": "quick",
    "startedAt": "2026-08-04T17:19:08.167Z"
  },
  "scenarios": [
    {
      "durationMs": 626.0,
      "id": "baseline",
      "notes": [
        "Baseline runtime findings were recorded."
      ],
      "status": "completed-with-findings",
      "translations": {
        "zh-CN": {
          "notes": [
            "已记录基线运行时问题。"
          ]
        }
      }
    },
    {
      "durationMs": 568.0,
      "id": "mobile-375",
      "notes": [],
      "status": "passed",
      "translations": {
        "zh-CN": {
          "notes": []
        }
      }
    },
    {
      "durationMs": 1209.0,
      "id": "long-text",
      "notes": [
        "5 deterministic text mutations were applied."
      ],
      "status": "passed",
      "translations": {
        "zh-CN": {
          "notes": [
            "已执行 5 次确定性的文本替换。"
          ]
        }
      }
    },
    {
      "durationMs": 1053.0,
      "id": "rtl-arabic",
      "notes": [
        "Directionality stress test only; translation quality was not assessed."
      ],
      "status": "passed",
      "translations": {
        "zh-CN": {
          "notes": [
            "仅进行书写方向压力测试；未评估翻译质量。"
          ]
        }
      }
    },
    {
      "durationMs": 580.0,
      "id": "image-failure",
      "notes": [
        "Expected image request aborts were excluded from failed-request findings."
      ],
      "status": "passed",
      "translations": {
        "zh-CN": {
          "notes": [
            "预期的图片请求中止未计入普通请求失败问题。"
          ]
        }
      }
    },
    {
      "durationMs": 966.0,
      "id": "keyboard-tab",
      "notes": [
        "No controls were activated or submitted."
      ],
      "status": "passed",
      "translations": {
        "zh-CN": {
          "notes": [
            "未激活或提交任何控件。"
          ]
        }
      }
    }
  ],
  "schemaVersion": "1",
  "score": {
    "baselinePenalty": 4.0,
    "chaosPenalty": 0.0,
    "counts": {
      "critical": 0,
      "info": 0,
      "major": 1,
      "minor": 0
    },
    "ignoredLowConfidenceFindings": 0,
    "overall": 96,
    "scoredFindings": 1,
    "totalFindings": 1
  },
  "target": {
    "finalUrl": "http://127.0.0.1:4182/examples/link-lab/broken.html",
    "requestedUrl": "http://127.0.0.1:4182/examples/link-lab/broken.html",
    "title": "RealityCheck link integrity lab — broken"
  },
  "threshold": {
    "coveragePercent": 100.0,
    "failOn": "major",
    "met": true,
    "violations": [
      {
        "actual": 1,
        "code": "severity-threshold",
        "expected": 0
      }
    ]
  },
  "toolVersion": "0.4.0",
  "translations": {
    "zh-CN": {
      "warnings": [
        "独立核查使用了已安装的系统浏览器（150.0.7871.116）。",
        "自动化问题仍然属于有边界的观察结果；修复前请人工复核低置信度项目。",
        "链接完整性仅使用 HEAD 核查了 2 个同源目标：1 个失败，0 个不支持 HEAD，1 个被安全策略排除，0 个超过配置上限。"
      ]
    }
  },
  "warnings": [
    "Standalone audit used an already-installed system browser (150.0.7871.116).",
    "Automated findings remain bounded observations; review low-confidence items before fixing.",
    "Link integrity checked 2 same-origin target(s) with HEAD only: 1 failed, 0 did not support HEAD, 1 were excluded by safety policy, and 0 exceeded the configured cap."
  ]
}
